ID,Sentence DE,Kincaid,ARI,Coleman-Liau,FleschReadingEase,GunningFogIndex,LIX,SMOGIndex,RIX,DaleChallIndex,characters_per_word,syll_per_word,words_per_sentence,sentences_per_paragraph,type_token_ratio,characters,syllables,words,wordtypes,sentences,paragraphs,long_words,complex_words,complex_words_dc,tobeverb,auxverb,conjunction,pronoun,preposition,nominalization,interrogative,article,subordination
144,"Geldautomaten waren ursprünglich in Bankfilialen installiert, aber mit der Netzanbindung kamen andere Standorte hinzu.",18.52714285714286,20.222142857142856,25.34472264285715,-12.832142857142818,14.171428571428573,56.857142857142854,12.486832980505138,6.0,12.225900000000001,7.357142857142857,2.4285714285714284,14.0,1.0,1.0,103.0,34.0,14.0,14.0,1.0,1.0,6.0,3.0,7.0,1.0,0.0,0.0,0.0,0.0,1.0,0.0,0.0,0.0
730,"Man geht allerdings davon aus, dass er der Meinung war, das norwegische Parlament, das nur für die Innenpolitik verantwortlich war, wäre Manipulationen durch die Regierung weniger stark ausgesetzt.",17.665714285714284,20.325357142857143,17.791629392857146,18.279285714285738,18.342857142857145,63.714285714285715,15.24744871391589,10.0,7.844942857142858,5.892857142857143,1.8928571428571428,28.0,1.0,0.8928571428571429,165.0,53.0,28.0,25.0,1.0,1.0,10.0,5.0,5.0,3.0,0.0,0.0,0.0,0.0,1.0,0.0,0.0,0.0
614,"Aus den Ablagerungen von Sanden, Tonen und den Kalkgehäusen von Zooplankton in einem Urmeer entstanden zunächst Gesteine wie Sandstein, Schiefer und Kalkstein.",14.444545454545459,18.47227272727273,18.9352235,30.686818181818197,10.618181818181819,62.90909090909091,8.477225575051662,9.0,12.6227,6.136363636363637,1.8181818181818181,22.0,1.0,0.8636363636363636,135.0,40.0,22.0,19.0,1.0,1.0,9.0,1.0,11.0,0.0,0.0,0.0,0.0,1.0,0.0,0.0,0.0,0.0
464,Im Gegensatz zur Lufttemperatur existieren für den Niederschlag keine eindeutigen Trends.,15.518181818181823,17.46818181818182,23.20293218181819,3.3972727272727283,11.672727272727274,56.45454545454545,10.745966692414834,5.0,12.794827272727273,7.090909090909091,2.272727272727273,11.0,1.0,1.0,78.0,25.0,11.0,11.0,1.0,1.0,5.0,2.0,6.0,0.0,0.0,0.0,0.0,0.0,0.0,0.0,0.0,0.0
1057,Auf der Vorder-Seite steht: Für wie lange gilt der Ausweis.,2.645454545454548,4.194545454545455,6.632443000000002,95.68818181818182,4.4,20.090909090909093,3.0,1.0,7.053009090909091,4.2727272727272725,1.1818181818181819,11.0,1.0,0.9090909090909091,47.0,13.0,11.0,10.0,1.0,1.0,1.0,0.0,2.0,0.0,0.0,0.0,0.0,1.0,0.0,0.0,0.0,0.0
8,"Seifenblasen lösen auf physikalische Weise komplexe räumliche Probleme in der Mathematik, da sie im Gleichgewichtszustand die kleinste Oberfläche zwischen Punkten und Kanten bilden.",15.953913043478263,22.22086956521739,23.049166739130435,21.646521739130463,10.93913043478261,70.82608695652175,8.477225575051662,11.0,13.015560869565219,6.826086956521739,1.9130434782608696,23.0,1.0,1.0,157.0,44.0,23.0,23.0,1.0,1.0,11.0,1.0,12.0,0.0,0.0,0.0,0.0,0.0,0.0,0.0,0.0,0.0
324,"Die Pluralisierung der Familienformen mit zunehmender Zahl von Patchwork- und Einelternfamilien erfordert gesellschaftliche Anpassungen, um eine finanzielle Überforderung der Unterhalt zahlenden Eltern beziehungsweise der Sozialsysteme zu vermeiden und zugleich allen Personen einen angemessenen Lebensunterhalt zu sichern.",27.95,33.8575,29.926147527777786,-41.20499999999999,23.28888888888889,91.55555555555556,18.491933384829668,20.0,13.3171,7.916666666666667,2.5,36.0,1.0,0.8888888888888888,285.0,90.0,36.0,32.0,1.0,1.0,20.0,8.0,18.0,0.0,0.0,0.0,0.0,0.0,1.0,0.0,1.0,0.0
773,"Es erstreckte sich über eine Fläche von ca 33,67 Millionen km², was einem Viertel der Landfläche der Erde entspricht.",9.910000000000004,11.178000000000004,10.943116799999999,59.63500000000002,10.0,45.0,8.477225575051662,5.0,12.5235,4.8,1.5,20.0,1.0,0.95,96.0,30.0,20.0,19.0,1.0,1.0,5.0,1.0,10.0,0.0,0.0,0.0,1.0,0.0,0.0,0.0,0.0,0.0
365,"Zwischen den globalen Temperaturen und der Biodiversität gibt es einen langfristigen Zusammenhang, der sich anhand von Fossilienfunden bis vor 520 Millionen Jahren feststellen lässt.",19.336666666666662,21.38125,21.43041795833333,-0.8249999999999744,14.600000000000001,61.5,12.486832980505138,9.0,10.74815,6.541666666666667,2.1666666666666665,24.0,1.0,0.9583333333333334,157.0,52.0,24.0,23.0,1.0,1.0,9.0,3.0,9.0,0.0,0.0,0.0,0.0,1.0,0.0,0.0,0.0,0.0
141,"Einige GAA wurden für Rollstuhlfahrer oder kleine Menschen optimiert: Zugänge zu Bankautomaten wurden mit Rampen versehen, um Treppen umgehen zu können.",16.761904761904763,18.002857142857145,18.909362619047627,12.291428571428611,14.114285714285714,59.095238095238095,12.486832980505138,8.0,11.445242857142857,6.142857142857143,2.0476190476190474,21.0,1.0,0.9047619047619048,129.0,43.0,21.0,19.0,1.0,1.0,8.0,3.0,9.0,0.0,1.0,0.0,0.0,0.0,0.0,0.0,0.0,0.0
834,Die Großeltern mütterlicherseits hatten ihren Nachnamen Dörzbacher in Koch geändert.,15.45,18.424,24.751365400000005,2.1050000000000253,8.0,60.0,8.477225575051662,5.0,13.6065,7.4,2.3,10.0,1.0,1.0,74.0,23.0,10.0,10.0,1.0,1.0,5.0,1.0,6.0,0.0,0.0,0.0,0.0,0.0,0.0,0.0,1.0,0.0
662,"Zunehmend Bedeutung erlangt das Recycling auch bei Elementen, deren Vorkommen begrenzt sind oder deren Gewinnung aufwändig ist.",15.334117647058822,17.269411764705886,20.158988882352944,15.403529411764733,9.15294117647059,69.94117647058823,8.477225575051662,9.0,11.910288235294118,6.411764705882353,2.0588235294117645,17.0,1.0,0.9411764705882353,109.0,35.0,17.0,16.0,1.0,1.0,9.0,1.0,8.0,2.0,0.0,0.0,0.0,0.0,1.0,0.0,0.0,0.0
930,Des Weiteren soll es beratend tätig werden und den Kommissionspräsidenten wählen.,14.445454545454545,14.04272727272727,18.926676909090915,11.088181818181845,8.036363636363637,38.27272727272727,8.477225575051662,3.0,8.488463636363637,6.363636363636363,2.1818181818181817,11.0,1.0,1.0,70.0,24.0,11.0,11.0,1.0,1.0,3.0,1.0,3.0,0.0,2.0,0.0,0.0,0.0,0.0,0.0,1.0,0.0
962,"Die Rolle des Europäischen Parlaments wurde durch die Einführung des Mitentscheidungsverfahrens, das es dem Rat der EU in einer Reihe von Politikfeldern gleichstellte, erneut aufgewertet.",16.816,21.214000000000006,20.646751200000004,19.028000000000024,11.600000000000001,53.0,8.477225575051662,7.0,9.2977,6.4,1.92,25.0,1.0,0.96,160.0,48.0,25.0,24.0,1.0,1.0,7.0,1.0,7.0,0.0,0.0,0.0,0.0,0.0,1.0,0.0,1.0,0.0
385,"Nach verschiedenen Szenarien des IPCC werden bis 2100 Anstiege zwischen 0,40 m bei strengem Klimaschutz und 0,67 m bei weiter steigenden Emissionen (Business as usual) gegenüber dem Stand der 1990er Jahre erwartet.",17.452352941176475,20.228235294117646,14.111731235294119,30.495588235294143,18.30588235294118,66.35294117647058,13.954451150103322,11.0,13.682311764705885,5.235294117647059,1.6764705882352942,34.0,1.0,0.9117647058823529,178.0,57.0,34.0,31.0,1.0,1.0,11.0,4.0,18.0,0.0,1.0,0.0,0.0,1.0,0.0,0.0,0.0,0.0
248,"Beim Casinospiel Craps sowie von einigen Rollenspielern ist dies jedoch verpönt, da ungleichmäßige Abrundungen bestimmte Landeflächen bevorzugen könnten.",18.963333333333335,22.633333333333333,26.327682333333335,-8.834999999999997,13.866666666666667,73.55555555555556,12.486832980505138,10.0,12.4243,7.444444444444445,2.3333333333333335,18.0,1.0,1.0,134.0,42.0,18.0,18.0,1.0,1.0,10.0,3.0,9.0,1.0,1.0,0.0,0.0,0.0,0.0,0.0,0.0,0.0
817,"Albert Einstein (* 14 März 1879 in Ulm, Württemberg, Deutsches Reich; † 18 April 1955 in Princeton, New Jersey, Vereinigte Staaten) gilt als einer der bedeutendsten theoretischen Physiker der Wissenschaftsgeschichte und weltweit als bekanntester Wissenschaftler der Neuzeit.",13.149285714285714,18.002285714285712,20.811523657142864,31.95821428571431,10.428571428571429,57.5,9.70820393249937,7.0,13.527357142857143,6.514285714285714,1.8571428571428572,17.5,2.0,0.8857142857142857,228.0,65.0,35.0,31.0,2.0,1.0,14.0,3.0,20.0,0.0,0.0,0.0,0.0,0.0,0.0,0.0,0.0,0.0
660,"Erste Anfänge zurück zu einer neuen Wiederverwertung war die anfangs freiwillige Mülltrennung, die zum Sinnbild einer ganzen Generation in der westlichen Welt wurde.",14.927826086956525,18.944347826086954,18.95883560869565,29.003043478260906,12.678260869565218,57.78260869565217,10.745966692414834,8.0,10.269473913043479,6.130434782608695,1.826086956521739,23.0,1.0,0.9130434782608695,141.0,42.0,23.0,21.0,1.0,1.0,8.0,2.0,8.0,1.0,0.0,0.0,0.0,0.0,1.0,0.0,0.0,0.0
11,"Eine Seifenblase entsteht, wenn sich ein dünner Wasserfilm mit Seifenmolekülen vermischt.",13.372727272727271,17.04,22.668400272727276,18.779090909090932,4.4,56.45454545454545,3.0,5.0,12.794827272727273,7.0,2.090909090909091,11.0,1.0,1.0,77.0,23.0,11.0,11.0,1.0,1.0,5.0,0.0,6.0,0.0,0.0,0.0,0.0,0.0,0.0,0.0,1.0,0.0
264,"Die Klinge muss vor jeder Rasur auf einem Streichriemen abgeledert und in regelmäßigen Abständen nachgeschliffen werden, um die Schärfe der Schneide zu erhalten.",14.927826086956525,18.125217391304346,17.936252826086957,29.003043478260906,16.156521739130437,57.78260869565217,13.954451150103322,8.0,11.642517391304349,5.956521739130435,1.826086956521739,23.0,1.0,1.0,137.0,42.0,23.0,23.0,1.0,1.0,8.0,4.0,10.0,0.0,2.0,0.0,0.0,0.0,0.0,0.0,1.0,0.0
631,Der umgangssprachliche Gebrauch des Begriffs Recycling umfasst oft beide Bedeutungen.,13.09,18.895000000000003,25.339350500000002,19.025000000000013,8.0,70.0,8.477225575051662,6.0,13.6065,7.5,2.1,10.0,1.0,1.0,75.0,21.0,10.0,10.0,1.0,1.0,6.0,1.0,6.0,0.0,0.0,0.0,0.0,0.0,0.0,0.0,1.0,0.0
535,"Heute stammt immer noch der größere Teil der Wärmeleistung aus dem radioaktiven Zerfall der langlebigeren Nuklide im Mantel, 235U und 238U, 232Th und 40K.",12.945,15.689999999999998,14.325598000000003,45.000000000000014,12.933333333333332,49.0,10.745966692414834,6.0,12.7219,5.333333333333333,1.625,24.0,1.0,0.875,128.0,39.0,24.0,21.0,1.0,1.0,6.0,2.0,12.0,0.0,0.0,0.0,0.0,0.0,1.0,0.0,0.0,0.0
306,Diese Vorhersagen sind jedoch bisher nicht eingetreten.,12.425714285714289,14.367142857142852,20.291420000000002,18.44428571428573,8.514285714285714,35.57142857142857,8.477225575051662,2.0,8.495128571428571,6.857142857142857,2.142857142857143,7.0,1.0,1.0,48.0,15.0,7.0,7.0,1.0,1.0,2.0,1.0,2.0,1.0,0.0,0.0,0.0,0.0,0.0,0.0,0.0,0.0
612,"Über 2100 Höhenmeter in acht stratigrafischen Schichten sind im Park aufgeschlossen, was das Gebiet zum besten Forschungsgebiet für die physikalische und chemische Zusammensetzung proterozoischer Gesteine und damit der Umweltbedingungen auf der Erde im Zeitraum von vor zwischen 1,5 Milliarden und 900 Millionen Jahren weltweit macht.",24.667391304347827,30.956304347826084,20.241151586956526,0.14065217391305396,21.87826086956522,80.78260869565217,13.954451150103322,16.0,12.44005652173913,6.239130434782608,1.891304347826087,46.0,1.0,0.9130434782608695,287.0,87.0,46.0,42.0,1.0,1.0,16.0,4.0,19.0,1.0,0.0,0.0,0.0,1.0,1.0,0.0,0.0,0.0
587,"Der Berg ist der Wasserscheidepunkt an dessen Flanken sich die Einzugsgebiete des Pazifischen Ozeans, des Atlantischen Ozeans über den Golf von Mexiko und des Arktischen Ozeans über die Hudson Bay berühren.",16.293548387096777,20.506774193548388,16.247802258064517,33.460322580645176,13.690322580645162,53.58064516129032,8.477225575051662,7.0,12.814422580645163,5.612903225806452,1.6774193548387097,31.0,1.0,0.8064516129032258,174.0,52.0,31.0,25.0,1.0,1.0,7.0,1.0,15.0,1.0,0.0,0.0,0.0,0.0,0.0,0.0,1.0,0.0
601,"Im Osten des Parks wurden 1937 am Two Medicine Lake +47 °C gemessen, südlich des Parks am Rogers Pass 1954 ?57 °C, die niedrigste Temperatur der Vereinigten Staaten außerhalb Alaskas.",14.990000000000006,16.649,12.024223233333338,41.02500000000003,14.666666666666666,60.0,10.745966692414834,9.0,15.651166666666665,4.9,1.6,30.0,1.0,0.8666666666666667,147.0,48.0,30.0,26.0,1.0,1.0,9.0,2.0,20.0,0.0,0.0,0.0,0.0,0.0,0.0,0.0,0.0,0.0
281,Seit der Spätantike war die Bartlosigkeit ein Kennzeichen des abendländischen Klerus.,13.372727272727271,15.755454545454548,21.06480454545455,18.779090909090932,8.036363636363637,47.36363636363637,8.477225575051662,4.0,11.359372727272728,6.7272727272727275,2.090909090909091,11.0,1.0,1.0,74.0,23.0,11.0,11.0,1.0,1.0,4.0,1.0,5.0,1.0,0.0,0.0,0.0,1.0,1.0,0.0,0.0,1.0
627,"Der Begriff „Recycling“ ist ein Lehnwort aus dem Englischen (recycling – ausgesprochen [???sa?kl??] – für „Wiederverwertung“ oder „Wiederaufbereitung“); etymologisch leitet es sich vom griechischen kýklos (Kreis) sowie dem lateinischen Präfix re- (zurück, wieder) ab.",19.807272727272736,24.757272727272728,20.36349078787879,11.83090909090911,18.04848484848485,66.33333333333334,13.954451150103322,11.0,13.407542424242424,6.303030303030303,1.9090909090909092,33.0,1.0,0.9696969696969697,208.0,63.0,33.0,32.0,1.0,1.0,11.0,4.0,17.0,1.0,0.0,0.0,0.0,0.0,1.0,0.0,1.0,0.0
1010,Er wollte damals trotz seines tiefen Glaubens kein Prediger werden.,8.370000000000001,10.417000000000002,14.755618700000007,52.865000000000016,4.0,30.0,3.0,2.0,8.8695,5.7,1.7,10.0,1.0,1.0,57.0,17.0,10.0,10.0,1.0,1.0,2.0,0.0,3.0,0.0,1.0,0.0,1.0,0.0,0.0,0.0,0.0,0.0
316,In Deutschland werden Infrastrukturmaßnahmen in Kombination mit Änderungen der familienbezogenen Transferleistungen und der Besteuerung insbesondere als wesentlich für eine Verringerung der Kinder- und Familienarmut genannt.,24.840000000000007,28.373199999999997,29.584124720000005,-38.49999999999997,14.8,73.0,12.486832980505138,12.0,10.5609,7.92,2.6,25.0,1.0,0.88,198.0,65.0,25.0,22.0,1.0,1.0,12.0,3.0,9.0,0.0,1.0,0.0,0.0,1.0,1.0,0.0,0.0,0.0
1104,Sie können dieses Geld bekommen und damit selbst Ihre Betreuer bezahlen.,9.081818181818182,10.189090909090911,14.11588972727273,49.542727272727284,11.672727272727274,38.27272727272727,10.745966692414834,3.0,7.053009090909091,5.545454545454546,1.7272727272727273,11.0,1.0,1.0,61.0,19.0,11.0,11.0,1.0,1.0,3.0,2.0,2.0,0.0,1.0,0.0,1.0,0.0,0.0,0.0,0.0,0.0
523,"Sie umfasst die in der Erde gespeicherte Energie, soweit sie entzogen und genutzt werden kann, und zählt zu den regenerativen Energien.",12.26666666666667,14.189999999999998,14.14948323809524,44.52000000000001,14.114285714285714,54.333333333333336,12.486832980505138,7.0,12.197147619047618,5.333333333333333,1.6666666666666667,21.0,1.0,0.9523809523809523,112.0,35.0,21.0,20.0,1.0,1.0,7.0,3.0,10.0,0.0,2.0,0.0,1.0,0.0,0.0,0.0,0.0,0.0
478,"Auf eine Klimaerwärmung wie die globale Erwärmung oder eine Abnahme des Schneefalls, die zu einer negativen Massenbilanz führen, reagiert der Gletscher mit einem Rückgang.",15.895,19.026249999999997,18.49049245833333,23.85000000000001,11.266666666666666,65.66666666666666,8.477225575051662,10.0,11.406066666666668,6.041666666666667,1.875,24.0,1.0,0.9166666666666666,145.0,45.0,24.0,22.0,1.0,1.0,10.0,1.0,10.0,0.0,0.0,0.0,0.0,1.0,1.0,0.0,0.0,0.0
920,"Dies bewirkt auch, dass die einzelnen Europa-Abgeordneten unabhängiger sind und mit Verhandlungsgeschick und Sachkenntnis größeren Einfluss auf die EU-Gesetzgebung haben, als es Abgeordneten nationaler Parlamente möglich ist.",20.13379310344828,24.578275862068963,22.513120620689655,2.3655172413793117,17.117241379310343,73.82758620689656,13.954451150103322,13.0,11.064210344827586,6.689655172413793,2.0689655172413794,29.0,1.0,0.896551724137931,194.0,60.0,29.0,26.0,1.0,1.0,13.0,4.0,11.0,2.0,1.0,0.0,0.0,0.0,1.0,0.0,0.0,0.0
97,"Wichtig ist, beim Fahrradfahren eine möglichst gleichmäßige Belastung der Kontaktpunkte des Fahrers mit dem Fahrrad gemäß der natürlichen Anatomie des Menschen zu erreichen.",16.46695652173913,20.582608695652176,21.00400117391304,17.968260869565228,14.417391304347825,75.17391304347825,12.486832980505138,12.0,11.642517391304349,6.478260869565218,1.9565217391304348,23.0,1.0,0.9130434782608695,149.0,45.0,23.0,21.0,1.0,1.0,12.0,3.0,10.0,1.0,0.0,0.0,0.0,0.0,1.0,0.0,0.0,0.0
768,Die Verleihung des Preises an Institutionen wurde zum Teil ebenfalls heftig kritisiert.,11.706666666666667,14.0075,18.482658083333334,32.505,11.466666666666667,53.666666666666664,10.745966692414834,5.0,10.810866666666668,6.25,1.9166666666666667,12.0,1.0,1.0,75.0,23.0,12.0,12.0,1.0,1.0,5.0,2.0,5.0,0.0,0.0,0.0,0.0,0.0,1.0,0.0,1.0,0.0
76,"Außerdem waren bereits zahlreiche Heilquellen bekannt, von denen viele Göttern geweiht waren.",12.690000000000001,15.970000000000006,20.932596000000004,25.45500000000002,4.800000000000001,70.33333333333334,3.0,7.0,9.495033333333332,6.666666666666667,2.0,12.0,1.0,0.9166666666666666,80.0,24.0,12.0,11.0,1.0,1.0,7.0,0.0,4.0,2.0,0.0,0.0,0.0,0.0,0.0,0.0,0.0,0.0
877,Deren Glaubwürdigkeit hätte ein gleichzeitiger Angriff der Flotte zunichtegemacht.,14.142222222222227,21.273333333333333,28.603845222222226,9.700000000000008,12.488888888888889,53.44444444444444,10.745966692414834,4.0,12.855122222222224,8.11111111111111,2.2222222222222223,9.0,1.0,1.0,73.0,20.0,9.0,9.0,1.0,1.0,4.0,2.0,5.0,0.0,1.0,0.0,0.0,0.0,1.0,0.0,0.0,0.0
490,Zur Rekonstruktion vergangener Klimazustände gibt es eine Reihe verschiedener Untersuchungsmethoden.,21.349999999999998,25.96,34.159127000000005,-40.19499999999996,12.0,60.0,10.745966692414834,5.0,12.0275,9.0,2.8,10.0,1.0,1.0,90.0,28.0,10.0,10.0,1.0,1.0,5.0,2.0,5.0,0.0,0.0,0.0,0.0,0.0,0.0,0.0,0.0,0.0
242,"Allerdings können die Landewahrscheinlichkeiten neben der Geometrie noch von anderen Bedingungen abhängen, zum Beispiel von der Reibung zwischen Würfel und Unterlage oder – auch unbeabsichtigt – von der Wurftechnik.",18.97703703703704,23.993333333333332,22.95569425925926,7.096666666666668,15.244444444444447,71.44444444444444,12.486832980505138,12.0,10.239033333333332,6.777777777777778,2.037037037037037,27.0,1.0,0.8518518518518519,183.0,55.0,27.0,23.0,1.0,1.0,12.0,3.0,9.0,0.0,1.0,0.0,0.0,0.0,1.0,0.0,0.0,0.0
220,"Dabei können die Ergebnisse addiert werden (eine Waffe in einem Rollenspiel richtet soviel Schaden an, wie zwei Würfel zusammen anzeigen) oder als Ensemble betrachtet werden (bei vielen Brettspielen folgen besondere Aktionen, wenn mehrere Würfel die gleiche Zahl zeigen, bei einem sogenannten Pasch).",22.14238095238095,27.71785714285714,18.633846500000004,11.119285714285724,21.561904761904763,77.71428571428572,15.24744871391589,15.0,12.110890476190475,5.976190476190476,1.8095238095238095,42.0,1.0,0.8809523809523809,251.0,76.0,42.0,37.0,1.0,1.0,15.0,5.0,17.0,0.0,3.0,0.0,0.0,0.0,0.0,0.0,0.0,0.0
372,"Bei Einhaltung des Zwei-Grad-Ziels könnte die Rate weltweit auf 5,2 % reduziert werden.",6.780000000000001,8.05,9.666015333333334,73.17000000000003,8.666666666666668,35.0,8.477225575051662,3.0,11.749166666666667,4.666666666666667,1.4,15.0,1.0,1.0,70.0,21.0,15.0,15.0,1.0,1.0,3.0,1.0,7.0,0.0,2.0,0.0,0.0,1.0,1.0,0.0,0.0,0.0
214,"Darüber hinaus sind Würfel in einer Vielzahl von Brettspielen bedeutend, um etwa die Bewegungsgeschwindigkeit von Spielfiguren oder den Ausgang von Zufallsereignissen zu bestimmen.",19.54521739130435,22.01608695652174,22.793521043478265,-4.101304347826073,12.678260869565218,62.130434782608695,10.745966692414834,9.0,10.955995652173913,6.782608695652174,2.217391304347826,23.0,1.0,0.9130434782608695,156.0,51.0,23.0,21.0,1.0,1.0,9.0,2.0,9.0,1.0,0.0,0.0,0.0,0.0,1.0,0.0,0.0,0.0
1016,So wurde er 1954 Pastor der Dexter Avenue Baptist Church in Montgomery (Alabama).,6.726153846153846,8.982307692307693,11.774802615384615,69.99384615384618,5.2,36.07692307692308,3.0,3.0,13.998223076923077,5.076923076923077,1.4615384615384615,13.0,1.0,1.0,66.0,19.0,13.0,13.0,1.0,1.0,3.0,0.0,8.0,0.0,0.0,0.0,0.0,0.0,0.0,0.0,0.0,0.0
684,Trotz dieses militärischen Triumphs verlor er die Unterhauswahlen des Jahres 1945.,11.22727272727273,14.470909090909089,19.461208818181824,34.16090909090911,8.036363636363637,38.27272727272727,8.477225575051662,3.0,11.359372727272728,6.454545454545454,1.9090909090909092,11.0,1.0,1.0,71.0,21.0,11.0,11.0,1.0,1.0,3.0,1.0,5.0,0.0,0.0,0.0,0.0,1.0,0.0,0.0,0.0,0.0
204,Dieses Symbol gilt dann als Ergebnis des Wurfes.,3.7550000000000026,6.120000000000001,9.900041000000005,82.39000000000001,3.2,20.5,3.0,1.0,7.9808,5.0,1.375,8.0,1.0,1.0,40.0,11.0,8.0,8.0,1.0,1.0,1.0,0.0,2.0,0.0,0.0,0.0,0.0,0.0,1.0,0.0,0.0,0.0
241,"Bei einigen Formen kann man versuchen, dies durch die richtige Wahl der Größenverhältnisse auszugleichen, etwa durch Streckung der Seitenflächen beim nebenstehenden Prisma als siebenseitiger Würfel.",18.232000000000003,23.2864,23.233885640000004,8.876000000000008,18.0,61.0,15.24744871391589,9.0,11.8241,6.84,2.04,25.0,1.0,0.92,171.0,51.0,25.0,23.0,1.0,1.0,9.0,5.0,11.0,0.0,1.0,0.0,0.0,1.0,1.0,0.0,0.0,0.0
100,"Um eine optimale Versorgung der Füße und eine möglichst geringe Belastung der Knie zu erreichen, sollte die Sattelhöhe so eingestellt werden, dass beim Treten der Pedale am tiefsten Punkt das Bein immer noch leicht angewinkelt ist.",18.444444444444446,21.820833333333333,14.89986163888889,26.945000000000014,18.844444444444445,63.77777777777778,13.954451150103322,10.0,12.001266666666668,5.361111111111111,1.6944444444444444,36.0,1.0,0.9166666666666666,193.0,61.0,36.0,33.0,1.0,1.0,10.0,4.0,15.0,1.0,2.0,0.0,0.0,1.0,1.0,0.0,0.0,0.0
1118,Und wir helfen Ihnen beim Ausfüllen vom Antrag.,3.7550000000000026,5.53125,9.165059625000005,82.39000000000001,3.2,20.5,3.0,1.0,7.9808,4.875,1.375,8.0,1.0,1.0,39.0,11.0,8.0,8.0,1.0,1.0,1.0,0.0,2.0,0.0,0.0,1.0,0.0,0.0,0.0,0.0,0.0,0.0
189,"Nach chemischer Härtung des Rußes war er in der Lage, auf galvanoplastischem Wege ein Zink-Positiv und von diesem ein Negativ der Platte anzufertigen, das als Stempel zur Pressung beliebig vieler Positive genutzt werden konnte – die Schallplatte war erfunden.",20.49692307692308,24.15615384615385,16.005876410256413,17.573076923076954,20.72820512820513,72.33333333333334,15.24744871391589,13.0,12.858592307692307,5.538461538461538,1.7692307692307692,39.0,1.0,0.9230769230769231,216.0,69.0,39.0,36.0,1.0,1.0,13.0,5.0,18.0,2.0,2.0,0.0,0.0,1.0,1.0,0.0,0.0,0.0
103,Somit kann eine falsche Beckenhaltung (zB um Missempfindungen aufgrund des Sattels zu vermeiden) zu einer starken Belastung der Wirbelsäule führen.,15.638095238095236,17.105714285714285,17.78939100000001,20.34857142857146,10.304761904761905,63.857142857142854,8.477225575051662,9.0,12.949052380952383,5.9523809523809526,1.9523809523809523,21.0,1.0,0.9523809523809523,125.0,41.0,21.0,20.0,1.0,1.0,9.0,1.0,11.0,0.0,1.0,0.0,0.0,0.0,1.0,0.0,0.0,0.0
800,"Während die Kolonien in Australien, Kanada, Neuseeland und Südafrika bereits im 19 und frühen 20 Jahrhundert als Dominions eine gewisse Eigenständigkeit erlangt hatten und diese danach stetig ausbauten, wurden die meisten Territorien des Britischen Weltreichs in der zweiten Hälfte des 20 Jahrhunderts im Zuge der Dekolonisation zu unabhängigen Staaten.",27.12,32.002857142857145,19.714458673469395,-12.099999999999973,21.232653061224493,91.85714285714286,10.745966692414834,21.0,13.478532653061224,6.142857142857143,2.0,49.0,1.0,0.8367346938775511,301.0,98.0,49.0,41.0,1.0,1.0,21.0,2.0,23.0,0.0,0.0,0.0,0.0,1.0,1.0,0.0,0.0,1.0
184,"Unabhängig von Tainter, der seine Ideen nicht publiziert hatte, gelangte im Jahre 1887 der deutsch-amerikanische Erfinder und Industrielle Emil Berliner bei seinen Versuchen mit dem Edison-Phonographen zu einem ähnlichen Verbesserungskonzept.",19.7525,25.184999999999995,21.493625,10.442500000000017,16.55,72.625,12.486832980505138,13.0,12.6252625,6.5,1.9375,32.0,1.0,0.96875,208.0,62.0,32.0,31.0,1.0,1.0,13.0,3.0,15.0,0.0,0.0,0.0,0.0,0.0,0.0,0.0,0.0,0.0
185,"Er hatte sich mehrere Jahre lang mit dem Edison-Phonographen befasst und früher als Edison erkannt, dass die Zukunft der Tonaufzeichnung in erster Linie im Unterhaltungsbereich lag.",14.60666666666667,18.759999999999998,16.422526481481484,38.43000000000001,10.8,52.925925925925924,3.0,7.0,10.239033333333332,5.666666666666667,1.6666666666666667,27.0,1.0,0.9629629629629629,153.0,45.0,27.0,26.0,1.0,1.0,7.0,0.0,9.0,0.0,0.0,0.0,1.0,0.0,1.0,0.0,0.0,0.0
726,"Der Preisträger des Friedensnobelpreises wird von einem fünfköpfigen Komitee, dem Norwegischen Nobelkomitee, ausgewählt.",19.43384615384615,23.112307692307688,29.414355615384615,-21.11384615384612,11.353846153846156,66.84615384615384,10.745966692414834,7.0,12.783607692307694,8.076923076923077,2.5384615384615383,13.0,1.0,1.0,105.0,33.0,13.0,13.0,1.0,1.0,7.0,2.0,7.0,0.0,1.0,0.0,0.0,0.0,0.0,0.0,1.0,0.0
462,"Nach dem 2007 erschienenen Vierten Sachstandsbericht der Zwischenstaatlichen Sachverständigengruppe über Klimaänderungen (IPCC) stieg die weltweite durchschnittliche Lufttemperatur in Bodennähe zwischen 1906 und 2005 um 0,74 °C (± 0,18 °C) an.",20.099999999999998,25.064838709677424,21.93798064516129,6.170000000000023,14.980645161290324,66.48387096774194,10.745966692414834,11.0,15.870551612903224,6.580645161290323,2.0,31.0,1.0,0.9354838709677419,204.0,62.0,31.0,29.0,1.0,1.0,11.0,2.0,21.0,0.0,0.0,0.0,0.0,1.0,0.0,0.0,0.0,0.0
717,Seinen ersten bedeutenden Auftritt im Parlament hatte er am 31 Mai 1904 mit dem demonstrativen Übertritt von den Konservativen zu den Liberalen.,15.51727272727273,15.689090909090915,15.460766090909093,22.99590909090911,12.436363636363637,53.81818181818181,10.745966692414834,7.0,10.469518181818183,5.545454545454546,1.9090909090909092,22.0,1.0,0.9545454545454546,122.0,42.0,22.0,21.0,1.0,1.0,7.0,2.0,8.0,0.0,0.0,0.0,1.0,0.0,0.0,0.0,0.0,0.0
1111,"Sie entscheiden, welcher Betreuer Ihnen helfen soll.",7.368571428571428,11.675714285714285,16.931505142857148,54.7014285714286,8.514285714285714,49.857142857142854,8.477225575051662,3.0,8.495128571428571,6.285714285714286,1.7142857142857142,7.0,1.0,1.0,44.0,12.0,7.0,7.0,1.0,1.0,3.0,1.0,2.0,0.0,1.0,0.0,1.0,0.0,0.0,0.0,0.0,0.0
594,"In die beiden Nationalforste ist die nur durch die Bahn und die Straße vom Park getrennte Great Bear Wilderness eingelagert, ein Wilderness Area und damit die strengste Klasse von Naturschutzgebieten der Vereinigten Staaten.",16.94666666666667,22.188181818181818,17.156299333333344,32.34000000000001,14.412121212121214,60.27272727272727,8.477225575051662,9.0,11.97208787878788,5.757575757575758,1.6666666666666667,33.0,1.0,0.8181818181818182,190.0,55.0,33.0,27.0,1.0,1.0,9.0,1.0,14.0,1.0,0.0,0.0,0.0,1.0,0.0,0.0,0.0,0.0
